player,team,position,scouting_report
Leo Carlsson,Anaheim Ducks,Forward,"A developing two-way forward who has already shown a balanced and efficient skillset. Focuses on creating offence in the slot, he takes and setting up very few shots from the perimeter and using his skating and handling ability to transports the puck to dangerous areas of the ice. A crafty and creative player with the puck on his stick, where he makes quality plays in transition, uses his hands to take on defenders one-on-one, and rarely turns over the puck, and without it where he cleanly steals it from opponents. Not a checker despite his size and still a bit timid to get involved physically on the boards, but not afraid to go to the net."
Robby Fabbri,Anaheim Ducks,Forward,"A complementary depthwinger who gets to the net and scores with some efficiency but otherwise exerts a limited impact on the game. Skating and turnovers are an issue, and while he shows flashes of skill with the puck he spends very little time with it on his stick. Offers a bit of physicality and forechecking but plays a very slow game and has struggled defensively throughout his career."
Alex Killorn,Anaheim Ducks,Forward,"A veteran utility winger who can kill penalties and do some of the hard work in the defensive zone while putting the puck in the net at a solid rate. Not exactly speedy at this point in his career, but maintains solid offensive instincts and skills that make him a reasonable complementary piece on either wing."
Chris Kreider,Anaheim Ducks,Forward,"A veteran scoring winger who terrorizes goalies in the front of the net with deflections, rebounds, and other shots from the inner slot. Separates himself from other crease crashers and screeners with a strong finishing touch and great mobility which allows him to be a threat to score and distribute the puck in transition as well -- not a lot of guys who play the way he does get as many breakaways. Nonetheless spends relatively little time with the puck on his stick, and as his skating declines the powerplay will likely be even more of a core part of his production than it is now."
Brock McGinn,Anaheim Ducks,Forward,A veteran fourth line winger who can be a speedy puck retriever without the puck but offers limited value with it. Willing to play a simple dump-and-chase game in transition and get to the net but not particularly creative outside of a defensive role.
Mason McTavish,Anaheim Ducks,Forward,"A developing shoot-first net-front player who uses his strong frame to gain position and jump on rebounds in the slot. Produces well and flashes high-end skill with small area plays but not yet having the overall impact on the game expected of his junior career, particularly defensively and along the boards where he hasn’t been able to assert himself. A low-workload transition player who prefers to carry the puck than pass it and must learn to overcome slow speed."
Ryan Strome,Anaheim Ducks,Forward,"A veteran playmaking winger whose effectiveness outside of creating opportunities for his linemates has diminished significantly. An average finisher who doesn’t shoot the puck much, a questionable defender despite often playing centre, one of the slowest skaters in the league, and a constant committer of stick infractions, his passing ability is rapidly getting overshadowed."
Troy Terry,Anaheim Ducks,Forward,"A creative dangling winger whose love of carrying the puck in transition and challenging defenders one-on-one is matched only by his absolute disinterest in throwing body-checks. Dominant with the puck on his stick at 5-on-5 and deadly off the rush, he’s showed tremendous upside as a scoring-chance creator but has been more sizzle than steak in the past two seasons. That said, his solid puck management and possession game combined with a near-league-best penalty differential pay strong dividends for the Ducks."
Frank Vatrano,Anaheim Ducks,Forward,"A middle-six scoring winger with strong physicality and skating. One-dimensional offensively, shooting the puck from the outer slot at a high frequency (often off the counter-attack) and finishing well too. Decent at separating opponents from the puck and can use his speed to chase hits, but otherwise uninvolved without the puck and not much of a battler or forechecker."
Radko Gudas,Anaheim Ducks,Defence,"A physical beast of a defensive defenceman who protects the front of the net and throws devastating body checks (often with questionable legality) with relish and great frequency. Happy to stand up opposing forwards entering the zone. Much more limited offensively, and while he can toss out the odd stretch pass his impact in transition is usually limited to chipping pucks off the glass. Possesses one of the hardest slap shots in the game and uses it often; adventures deeper in the offensive zone than the point are much rarer."
Jackson LaCombe,Anaheim Ducks,Defence,"A top-pairing two-way defenceman who makes a big impact on the game with his mobility, puck skills, and aggressive style of play. An opportunistic player in all three zones who wants to get involved and make a big, difference-making play, and has learned how to execute at a high level. Sees the ice incredibly well on the break-out, identifying options and equally capable of advancing the puck himself or delivering a clean build-up or stretch pass. Won’t hesitate to jump up in the play but moves around well enough to give linemates the option to hit him with a pass in the neutral zone without taking himself too far out of position and leaving his partner vulnerable. Plays a suffocatingly tight gap on the rush and focuses on killing plays early, using his feet, stick, and body in tandem to take away time and space. He’s a proactive defender whose speed allows him to close out quickly and also recover when things go badly, which mitigates the risks of the plays he makes with and without the puck. His solid build makes him no slouch in front of the net and helps him win 50/50 puck retrievals with frequency. Adjustments since his days as an NCAA prospect have blown his ceiling wide open, and he has legitimate high-end #1 defenceman potential having already shown he can hold up in heavy and difficult deployment."
Jacob Trouba,Anaheim Ducks,Defence,"A veteran checking offensive defenceman whose punishing and often borderline legal bodychecks have increasingly become the focal point of his game. Diminishing mobility and his eagerness to intimidate opponents have added up to a recklessness in his defensive game where chasing hits frequently means vacating important real estate closer to the net. When his shoulder (or elbow) connects with a rushing forward it can be devastating, but the uncomfortable truth is that few defenders get walked around with the frequency that he does and his ability to defend his blueline is deteriorating rapidly. Offensively he’s willing to join the rush and has a knack for shooting for deflections and targeting open sticks in the slot, but his own shooting efficiency is poor."
Pavel Mintyukov,Anaheim Ducks,Defence,"A developing offensive defenceman who showed plenty of skill with the puck on his stick, particularly when dishing it to rushing forwards or finding linemates in dangerous areas within the offensive zone. Had a relatively low workload in transition but made clean and successful plays maintaining possession when called upon. Struggled defensively but showed a willingness to engage physically and battle for the puck despite below-average size."
Morgan Geekie,Boston Bruins,Forward,"A hard-working utility winger with some playmaking skill in transition. Not a speedy skater but works hard in the corners and makes life unpleasant for opposing defenders. Gets to the net to deflect pucks but doesn’t create a high volume of scoring chances. Can move up and down the lineup, playing a simple game alongside skilled players or bottom six grinders."
Elias Lindholm,Boston Bruins,Forward,"A complementary scoring centre. At his best, provides a stabilizing defensive presence and fills in the blanks when playing with skilled linemates while contributing in all situations. Doesn’t require a lot of time with the puck to contribute, just gets to the middle of the ice and gets open for one-time passes or to jump on rebounds and loose pucks in tight. The style gives him a high scoring upside when playing with talented linemates but gives him a low floor as well as he’s very limited in terms of what he can do on his own. Manages the puck efficiently and is a reasonably good passer but shouldn’t be expected to drive his own line."
Casey Mittelstadt,Boston Bruins,Forward,"A playmaking middle-six two-way centre. Flashes high-end upside as a playmaker, making tape-to-tape passes directly into the slot and using saucer passes to slip them through traffic. Doesn’t tend to shoot the puck unless he absolutely has to, usually right at the net-mouth. Moves the puck up-ice with possession whenever possible, making him an effective play-driving centre, and has improved his defensive game in part by increasingly avoiding risky one-on-one deke attempts that were previously a fixture of his game."
David Pastrnak,Boston Bruins,Forward,"An elite scoring winger who plays the game with almost unmatched flair and creativity. His trademark is his almost unparalleled wrist shot from the top of the circle, which has terrorized goaltenders throughout his career, but he’s also got a terrific one-timer and a superb set of hands which he uses both to create shooting space and undress opponents. Combined with decent wheels and size, this allows him to navigate the neutral zone and challenge defenders one-on-one more than anybody else in the league. Admittedly, this ambition does come at a cost and those attempts to take the tough road to the net fail at a high rate and lead to a lot of turnovers. Nonetheless, he’s an adequate defender and willing to put in the work in his own end to counter-act them. An efficient passer who totally neglects the perimeter and focuses on targeting the slot, perhaps reasoning that anyone he sets up on the outside has a lower chance of scoring there than he does."
Pavel Zacha,Boston Bruins,Forward,"A playmaking utility forward who manages the puck carefully and prefers to make the simple feed to his linemates than do anything too ambitious with it himself both in transition and the offensive zone. Not a driver by any stretch but gets where he needs to be, whether deflecting pucks at the net-mouth or one-timing pucks in the top of the slot. Active in the defensive zone retrieving loose pucks and turning them into zone exits and kills penalties, but an inconsistent defender at even strength."
Hampus Lindholm,Boston Bruins,Defence,"A smooth-skating top-pairing two-way defender who dishes out crisp break-out passes. Equally comfortable moving the puck up-ice or carrying it through the neutral zone himself. Sees the ice well in the offensive zone, swinging the puck around the perimeter or pushing deeper into the zone to create more dangerous opportunities. Uses his mobility and an active defensive stick to force opponents to dump the puck, disrupt plays, block passing lanes, and retrieve loose pucks at high rates. Can tend to try to force the issue at both ends, occasionally chasing the play when caught in the zone on defence and taking penalties (despite rarely throwing hits) and turning the puck over."
Charlie McAvoy,Boston Bruins,Defence,"An #1 two-way defenceman who is ambitious with the puck but executes at an extremely high level. A well-rounded player who moves the puck in all three zones with accuracy whether he’s launching a stretch pass from his own end, setting up a rushing forward in the neutral zone, or teeing up linemates with one-time feeds or high-danger passes in tight. A strong puck-carrier who moves up the ice quickly and rarely makes a false move in transition, starting with a knack for turning loose pucks in the defensive zone into clean exits with possession. This balanced skillset has made him one of the game’s premier drivers from the blueline. Quick to recognize and exploit any opportunity to jump up in the play, foregoing low-percentage point shots in favour of receiving passes and carrying it closer to the net for a scoring chances. Has exceptional hands and isn’t afraid to take on other defenders one-on-one, resulting on occasion in highlight reel goals. Solidly built and capable of throwing punishing body-checks."
Nikita Zadorov,Boston Bruins,Defence,"A huge and physical defence-first blue-liner. Envious physical tools include a heavy slap shot and high-end straight line skating speed. Builds up momentum carrying the puck through the neutral zone, using his hands (and stick length) to weave through opponents. Makes a solid breakout pass too and while he almost always thinks shoot-first in the offensive zone he set ups chances off the rush as well while generally avoiding turnovers. Aggressiveness and stick are mostly assets defensively, although he can at times get walked around and isn’t as agile as he is fast. When chasing the play often crosses the line of legality and gets his stick tangled up, and rarely gets the benefit of the doubt."
Zach Benson,Buffalo Sabres,Forward,"A developing playmaking winger. Despite his small size and lack of foot speed, willing to engage along the boards and pressure opposing defenders on the forecheck and has shown high defensive upside. A high-IQ passer who makes the most of his time with the puck, making controlled plays in transition and tilting the ice effectively. Taking the next step will require improving skating and getting more touches offensively."
Peyton Krebs,Buffalo Sabres,Forward,"A playmaking defensive centre who has found himself stuck in a depth role due to difficulty asserting himself offensively. Willing to do the physical work to keep play along the boards and away from his goal and separates opponents from pucks at a strong rate, but is not a threat to shoot or score and hasn’t established himself as a top-six quality passer either."
Ryan McLeod,Buffalo Sabres,Forward,"A two-way centre who is one of the fastest skaters in the sport and uses it to win races to the puck all over the ice. Forces opposing defenders to back off off the rush and enters the zone with possession at a high rate. While he has good hands, he’s still working out how best to take advantage of the space he creates, although he has taken significant strides as a playmaker  A prolific puck thief who rarely turns the puck over himself and is an elite penalty killer. Average in the dot."
Josh Norris,Buffalo Sabres,Forward,"An efficient scoring centre with the tools to be more than that. Not a volume shooter at all, but converts on his chances at a consistently high rate due in part to his selectiveness. On the powerplay, he’s a major one-time option, although it remains to be seen whether the ability to overpower goaltenders with shots from the circle can return after three shoulder surgeries; for now, he’s made up for that by venturing closer to the cage and tapping in passes instead. At even strength, he has a tricky shot that he prefers to keep along the ice but does a lot of his damage on net-front deflections instead of perimeter snipes. Passing has never been a forté of his and most of his feeds are to the point. The rest of his tool-kit is above-average: he’s got breakaway footspeed, a strong defensive stick, solid physicality, and a willingness to block shots. Ideally with fewer interruptions from injury, all of this will come together to make him the high-end two-way centre he seemed primed to be as a rookie."
Jack Quinn,Buffalo Sabres,Forward,"A developing dynamic scoring winger who shows creativity with the puck, manipulates defenders with timing, and can put the puck in the net from anywhere. A shoot-first player who gets open in the outer slot for one-timers but a crafty passer as well off the rush. Defence is a work in progress, but stays above-water and kills penalties."
Tage Thompson,Buffalo Sabres,Forward,"A star scoring centre with a unique blend of size, hands, and finishing touch. Torments opposing defenders on the rush by drawing them in and then deking past them with his long stick, but if they leave him any space in the middle of the ice they risk exposing their goaltender to one of the best shots in hockey. Has shown upside as a playmaker but will always be a shoot-first player. Has a powerful skating stride despite his length. Performs best when kept away from traditional power-forward role along the boards and allowed to wait for the puck to come to him from forechecking wingers as opposed to chasing it down himself; unfortunately, needing to play centre exposes his near-league-worst faceoff ability."
Alex Tuch,Buffalo Sabres,Forward,"A playmaking top six winger who generates most of his offence off the rush. A quick skater who’s willing to crash the net for rebounds, he doesn’t throw the body but uses his 6”4 frame to win pucks and get to dangerous areas of the ice. Moves the puck up the ice swiftly in transition and finds open teammates in the slot. Defensive impact is less consistent but at his best he’s a committed forechecker and possession driver."
Jason Zucker,Buffalo Sabres,Forward,A veteran scoring winger who despite having lost the separating speed that made him a top-line sniper in his prime remains a solid creator of chances and goals when paired with a talented playmaker. Possesses a great one-timer from the outer slot but also willing to go to the net where he has good hands and finishing touch. Less of a factor defensively but brings a bit of physicality.
Rasmus Dahlin,Buffalo Sabres,Defence,"A star two-way left defenceman with elite puck skills, including exceptional ability to transport the puck from his own zone to the offensive zone using both his deceptive skating and passing ability. Once set up, controls play in the offensive zone, walking the line and distributing the puck from the point, pushing deeper towards the slot to get dangerous chances himself, or using his bomb of a point shot. An underrated defender who aggressively kills plays with terrific stick-checks, closes passing lanes, and actively retrieves loose pucks to get the break-out started. Contributes some physicality, but despite his agility lacks straight-line footspeed and takes more holding and hooking penalties than he ought to."
Owen Power,Buffalo Sabres,Defence,"A developing two-way puck-moving left defenceman who despite his size plays a cerebral game closer to the likes of Adam Fox than Chris Pronger. Takes almost no slap shots or one-timer point shots, preferring to carry the puck deeper into the offensive zone or distribute it to his defensive partner. Very active in transition; few defencemen pass the puck out of the defensive zone or carry it into the offensive zone with as much frequency. That process starts with a heavy workload in his own end, where Power has a long and effective stick and frequently chases pucks along the wall despite rarely throwing body checks. Despite a low top skating speed, moves efficiently up the ice and joins the rush. Can tend to be a bit soft in his own zone, losing battles for position that he should be dominating given his size and practically never throwing the body."
Bowen Byram,Buffalo Sabres,Defence,"A developing offensive defenceman who often seems to want to play like a forward. A swift skater with a terrific shot and the desire to carry the puck to dangerous areas, he’s shown flashes of high-end skill when it comes to carrying the puck through the neutral zone and taking control of the game in the offensive zone. But he’s struggled to assert that same impact and instead has become a drag on possession, disengaged in his own zone while playing recklessly elsewhere. There’s a high ceiling and low floor."
Mattias Samuelsson,Buffalo Sabres,Defence,"A defensive defenceman who plays a low-maintenance game that involves very little time with the puck. Prefers to make a pass out of the defensive zone rather than chipping it out, but doesn’t have the puck-moving skills to pull it off without turning it over. A strong and quick skater who plays a tight gap off the rush and is willing to engage physically along the boards. A non-factor in the offensive zone, except to tee up his defensive partners for one-timers."
Mikael Backlund,Calgary Flames,Forward,"A defensive match-up centre, capable of playing heavy unpleasant minutes even in his mid-30s. Surprisingly active with the puck, especially in transition where he uses above-average skating and passing ability to get the puck up ice and create most of his offence. Generates shots from the perimeter but struggles to finish his opportunities. A high-end chance suppressor thanks to strong puck management, a smart defensive stick, and willingness to engage on the forecheck. Draws few penalties."
Blake Coleman,Calgary Flames,Forward,"A hybrid checking line utility scoring winger who can still create offensively even if he doesn’t play as fast and active on the forecheck as he used to. An opportunistic counter-attack player who can be lethal shorthanded and with the net empty, although his finishing touch is inconsistent from year to year. Despite sub-six foot frame, plays pretty physically and takes too many penalties as a result."
Jonathan Huberdeau,Calgary Flames,Forward,"A one-dimensional playmaking winger whose cerebral extra-pass game requires linemates who can think the game at a high level and finish his high-danger passes. At his best, few are capable of sending passes into the slot like he can, and on occasion he can put the puck in the net, but in his 30s he’s had issues creating the quantity of scoring chances required to compensate for his lack of footspeed and lack of defensive involvement."
Nazem Kadri,Calgary Flames,Forward,"A steady pass-first top six centre who loves to have the puck on his stick, take on defenders one-on-one, and run the offence. Willing to create offence from anywhere in the zone, and one of the most prolific generators of shots and tips from the outer slot as well as maintaining possession by feeding his blueliners for point shots. A well below-average skater, not a brilliant defender, and relatively disengaged physically and along the walls at this point, but moves the puck up the ice at an elite rate, avoids turnovers well, and has always been one of the best penalty drawers in the NHL."
Andrei Kuzmenko,Calgary Flames,Forward,"A skilled net-front winger who makes up for near league-worst skating and physicality through sheer craftiness. Despite a very low quantity of puck touches, he has excellent hands (especially in tight) and the finishing touch to take advantage of the extra space he creates by deking defenders and goalies. One of the most efficient finishers in hockey due in part to a total refusal to shoot from long range. You’ll almost never see him throw a check or battle on the boards."
Martin Pospisil,Calgary Flames,Forward,"A physical winger (and occasional centre) who plays a reckless wrecking-ball dump-and-chase-and-forecheck game. High-end speed combine with a willingness to fly into corners and chase hits to make him one of the game’s most effective puck retrievers and most prolific takers of minor and major penalties. Possesses sneaky offensive skill, especially near the net where his passing ability suggests the potential for a greater offensive role in the future."
Yegor Sharangovich,Calgary Flames,Forward,"A one-dimensional scoring forward (usually a winger but very occasionally a centre) who despite occasionally contributing on the forecheck or along the walls can most often be found waiting for the puck around the net-front. Has a broad range of tools for scoring goals, including tips, one-timers, and one of the few wrists shots in the league that can pretty reliably beat set goalies from range. Weak defensively, a non-factor physically, and below-average both in terms of skating and workload with the puck."
Connor Zary,Calgary Flames,Forward,"A young pass-first two-way forward who puts in the hard work on the forecheck and showed a willingness to absorb contact and get to the net. An efficient scorer who produces from within the blue paint, often with a defender draped over him, and likes to shoot from distance. Has terrific hands which he uses to counter-act below-average skating."
Rasmus Andersson,Calgary Flames,Defence,"A big-minute right-handed offensive defenceman who passes the puck effectively in the offensive zone at 5-on-5, although more often D-to-D and around the perimeter than deeper near the net. Active in transition but more often as a puck carrier on zone entries than as an ambitious puck-mover from his own zone. This, combined with a fairly straightforward net-front game in his own end, makes him better suited to an ambitious puck-moving partner who’s active on the walls in his own zone than a stay-at-home linemate. Plays a very soft gap off the rush to protect the middle of the ice, rolling the red carpet for forwards trying to enter the Flames zone with possession, but gives up chances at a pretty high rate anyway."
Kevin Bahl,Calgary Flames,Defence,"A low-event stay-at-home defenceman who uses imposing size and a long stick to disrupt plays in his own zone at even strength and on the powerplay. Can make a break-out pass if needed but not active in transition. Offensive game consists mainly of point shots. Not one of the most prolific body-checkers in the NHL but takes a lot of holding, interference, and roughing minor penalties."
