player,team,position,scouting_report
Macklin Celebrini,San Jose Sharks,Forward,"A developing dynamic top line centre with two-way superstar potential. Combines eye-popping offensive skill with an unmatched motor and dogged desire to pursue the puck and make things happen all over the ice. Uses quick feet, agility, and sensational hands to drive the middle in transition, reading the play at top speed and processing how best to turn an entry into a scoring chance. Strong on the puck and not afraid to turn his back to the defender to gain that extra second. Boasts a wicked wrist shot that punishes any defenceman who gives him space to get it off, a hammer of a one-timer, an endless bag of tricks on breakaways, and soft hands around the net, adding make him a threat to score from anywhere in the zone. Uses his athleticism and fitness to never stop moving for entire shifts with and without the puck, circling the offensive zone, picking the right time to crash the net or rush to the back door, and quarterbacking the play from anywhere. On extended cycling sequences, uses the centre of the ice above the circles as a runway to attack the middle, get the puck to a winger on his flank for a one-timer, or simply wire a shot from distance himself. Makes life easy for his linemates by constantly moving to open spots, calling for the puck, and then carrying it where he can get it back to them in better condition. Understands the value of deception and combines it with his agility and motor to embarrass defenders and create open ice in the slot off-puck. Distracts defenders with flurries of fakes, pivots, and stick-handles to trick them into forgetting about his open linemate in the slot. Already an elite puck-battler on the wall and torments his opponents with an onslaught of stick-lifts and poke checks when they try to make a play with the puck, using his motor to chase all over the ice. Is still working out what he can get away with with the puck without turning it over and how to defend in the zone when full-tilt attack-the-carrier mode isn’t an option, but the skillset screams two-way superstar and offensively he’s not far off already."
Ty Dellandrea,San Jose Sharks,Forward,"A developing defensive winger who plays a gutsy physical game, attacking the puck with pace, throwing hits, and engaging opponents along the boards. Despite flashes of skill he’s mostly been limited to a dump-and-chase crash-the-net game with limited opportunities to create offence."
William Eklund,San Jose Sharks,Forward,"A developing playmaking winger who has shown flashes of high-end upside when it comes to distributing the puck. Rarely shoots the puck and scores even less at 5-on-5, but was the Sharks’ premier sniper on the powerplay as a rookie, scoring from one-timers in the right circle and crashing the net for rebounds, suggesting that his one-dimensional game has room for growth. Lack of size and speed may limit his upside, but he at least showed a willingness to engage in battles for the puck."
Barclay Goodrow,San Jose Sharks,Forward,"A depth checking winger whose game has simplified and diminished in the past several seasons. At one point a superb forechecker and strong defender, now relatively slow and uninvolved in battling for pucks and pressuring opponents with the puck while one of the least involved players in the league offensively. Can finish checks and drop the gloves."
Philipp Kurashev,San Jose Sharks,Forward,"A complementary forward who moves well and flashes creative playmaking ability. Not a play-driver by any means and shouldn’t be expected to create many opportunities for himself, but has upside as a passer and uses quick feet to pitch in off the rush. Provides limited bottom-six value due to his poor defensive impact."
Tyler Toffoli,San Jose Sharks,Forward,"A veteran scoring winger who, despite poor footspeed, is one of the league’s premier attackers off the rush. While other elements of his relatively complementary game can vary depending on his surroundings, what you can also count on is a volume of pucks on goal, especially from the outer slot. Toffoli’s smarts and instinct for the game allow him to get open for cross-ice feeds, sneak behind defences, and find soft areas where the puck always seems to get to him. Other aspects of his skillset are less exceptional, but he does make the simple continuation plays that don’t catch the eye but add up over time. You’ll rarely find him engaging physically on the forecheck or stealing pucks, but with the right linemates his style leads to lots of possession time and plenty of goals."
Alex Wennberg,San Jose Sharks,Forward,"A defensive playmaking centre who plays a stable, low-risk and relatively low-reward game. In the right role, can be an impressive and well-rounded passer, but has recently diminished in terms of creating opportunities for his linemates and producing at even strength. Extremely resistant to shooting the puck at 5-on-5 from anywhere on the ice. Despite limited offence, shows flashes of skill with great hands. Disciplined with the puck, rarely turning it over while having a strong defensive stick himself."
Mario Ferraro,San Jose Sharks,Defence,"A defence-first two-way defender with strong skating ability who plays a conservative game that involves very little involvement with the puck aside from putting low-percentage point shots on net. Mostly stays around the front of the net defensively, battling for position rather than chasing pucks and making plays with the puck in transition. Despite being small for a defenceman, not afraid to get involved physically."
Timothy Liljegren,San Jose Sharks,Defence,
Dmitry Orlov,San Jose Sharks,Defence,
Jan Rutta,San Jose Sharks,Defence,A stay-at-home depth defenceman with mobility and physicality but extremely limited puck skills and a habit for turning the puck over when forced to make a play. Puts pucks on net from the point with a decent shot but otherwise not a noteworthy offensive player.
Matty Beniers,Seattle Kraken,Forward,"A developing two-way playmaking centre still working out how to assert himself offensively. On offence, looks to pass first despite having a strong shot. Much of his creation originates in the defensive zone, where he ranks among the most active players in his age group in retrieving or stealing pucks and starting the rush from his own end of the ice. From there, he carries it through the neutral zone, often navigating around defenders before dishing a pass to an open linemate with speed. This skillset has made him an extremely effective defensive player, but until he’s more of a threat to score himself it limits his own offensive effectiveness."
Kaapo Kakko,Seattle Kraken,Forward,"A developing utility winger who protects the puck and contributes on the forecheck. While he’s shown flashes of the offensive upside he was drafted for, he has never developed the on-ice awareness to control the game offensively and still has too much tunnel vision with the puck on his stick to be much of a distributor unless the option is right in front of him. Lacks food speed and while he’s strong on the puck he’s not particularly physical either. His lack of progress in these areas makes it difficult to evision his upside as anything better than the third wheel retriever and net-crasher on a middle six unit."
Jared McCann,Seattle Kraken,Forward,"An efficient scoring centre who puts the puck in the net with sparkling efficiency. While he does have a great shot, the key to his gravity-defying finishing is that he strikes on high-percentage plays further out from the net like one-timers or screened shots from the outer slot or the perimeter, getting the goalie moving and opening up space to pick corners. Apart from his shot he’s a well-rounded if unexceptional two-way player who plays a clean game, shying away from physicality but drawing a lot of penalties."
Jaden Schwartz,Seattle Kraken,Forward,"A veteran playmaking two-way winger who uses his relatively short but sturdy frame to gain inside position in the slot and battle for pucks. Injuries and age have reduced his footspeed and made him more of a pure passer, and at this point he’s more of a utility piece to maintain possession than a line-driver. While he can still get to dangerous areas of the ice his finishing touch on those shots is poor and he struggles to put the puck in the net at 5-on-5."
Chandler Stephenson,Seattle Kraken,Forward,"A veteran playmaking centre whose game revolves around foot speed, carrying the puck through the neutral zone, and cycling the puck high in the offensive zone with a talented running mate. Shoots the puck very infrequently, and practically only off a pass and with lots of time and space. Undeniable passing upside but more dependent on his linemates than vise versa. Recently one of the fastest players in the league, but losing a step with each passing year. An unexceptional defender who doesn’t take penalties more due to a lack of physical engagement than strong discipline."
Eeli Tolvanen,Seattle Kraken,Forward,"A scoring winger whose game primarily revolves around puck-retrievals, pressuring and body-checking defencemen, and shooting and scoring off of extended offensive zone possessions. Has found a defensive niche even if his puck skills are much more limited than projected as a prospect."
Vince Dunn,Seattle Kraken,Defence,"A top-pairing offensive defenceman who moves the puck well in transition, controls play off the cycle, and puts the puck in the net at a strong rate. Has the creativity to set up linemates from the centre lane, venture towards the net to create chances for himself, and send pucks through to the net for deflections and rebounds. Deceptive in the neutral zone and clever at targeting linemates moving through the middle of the ice with speed to set up rush opportunities. A solid defensive stick and retrieves pucks in his own zone, but little physicality and can be weak in the net-front."
Brandon Montour,Seattle Kraken,Defence,"A smooth-skating second-pairing offensive defenceman who loves to join the rush, receive break-out passes and carry the puck into the offensive zone, and take it to the net for chances himself. Has a heavy slap-shot from the point but isn’t afraid to play like a fourth forward and take risks to shoot it from more dangerous areas of the ice. Some passing skill, but it’s not a significant strength of his game. Not particularly active in the defensive zone and prefers to be the beneficiary of a puck recovery and break-out pass than the initiator. His skillset can be maximized in a setting where he’s in the offensive zone as often as possible and doesn’t have to do the hard work defensively."
Adam Larsson,Seattle Kraken,Defence,"A stay-at-home defenceman who plays a conservative game with and without the puck with the exception of at times pushing further into the offensive zone to shoot the puck. Generally makes the safe play in transition. Protects the middle of the ice defensively off the rush and in sustained possessions rather than aggressively seeking to disrupt plays or chase loose pucks along the boards. As a result, needs a partner who’s willing and able to do the leg work to push play back in the right direction."
Jamie Oleksiak,Seattle Kraken,Defence,"A big veteran two-way defenceman who despite being one of the tallest and heaviest players in the league is a strong skater and plays with solid pace all over the ice. Limited as a puck-mover in transition and prone to turnovers, but an ambitious offensive-zone passer surprisingly adept at setting up linemates in dangerous areas of the ice. Has a bomb of a slap shot but rarely uses it, and picks his spots to jump up in the play and go to the net himself. Uses his massive stick and mobility in the defensive zone, disrupting plays along the boards, suppressing rush opportunities, and recovering loose pucks to turn into zone exits at a prolific and efficient clip. Doesn’t typically use his size to punish opponents physically but when he does (either in checks or fights) it can be deadly."
Pavel Buchnevich,St. Louis Blues,Forward,"A well-rounded top-line two-way forward who moves the puck up-ice in transition. An adaptable play-driver who matches his skill with the puck with an ability to fill in the blanks and provide value on any type of line. A pass-first player but gets to the net and has a knack for providing a target for cross-seam passes and deflections with nice finishing touch in tight; aside from when he takes a little extra time to deke around a goalie on the backhand, you almost never see him score of a non-one-timed or deflected shot. Improbably, the same is true of his playmaking: he wastes no time whatsoever with the puck, making quick, snappy passes often within a second of getting to the puck which allows him to advance it in transition and set up breakaways and shred the slot with speedy feeds after forechecking retrievals. These transition plays combined with strong possession have helped make him a terrific defensive player and a deadly penalty killer as well."
Dylan Holloway,St. Louis Blues,Forward,"A developing physical shot-first winger who battles for pucks like his life depends on it but doesn’t quite know what to do once he’s got it. He has solid hands and can gain the offensive zone, but what comes after that has often been elusive. His speed would suggest upside as a rush scorer, and there have been flashes in that direction that would help him fill a Josh Anderson role. Conversely, he seems to be a complete non-factor of a playmaker, lacking the ability to move the puck to dangerous areas and deferring entirely to safe low-high passes."
Mathieu Joseph,St. Louis Blues,Forward,"A speedy defensive middle six utility winger and penalty killer. Flashes offensive talent as a rusher, where he helps recover the puck in the defensive zone and move it up the ice either by carrying it or making short passes. From there he often makes simple but effective feeds, as his own shot is not particularly accurate. Provides defensive value through forechecking, physicality, and puck retrieval, although he gives some of it back through frequent turnovers, especially when he tries to do too much with it."
Jordan Kyrou,St. Louis Blues,Forward,"An offensive top-line winger with exceptional puck skills and the ability to pose a significant threat both as a passer and a shooter. Combines breakaway speed, superb hands, creativity, and a slick shot to be one of the better offensive weapons in the league when he’s at his best. Carries the puck through the neutral zone more than almost anyone, and how effective he is often depends on whether he’s able to turn those transitional plays into scoring chances. Even when he isn’t the one possessing the puck entering the zone, he makes himself a terrific target for west-to-east passes by gunning to the net with speed and catching defenders distracted. Uses his feet to draw defenders out of position before snapping passes to the slot from the wing or behind the net, and loves give-and-go plays off the rush. Figuring out how to make his game less high-risk, with fewer turnovers and lengthier offensive zone sequences a positive development."
Jake Neighbours,St. Louis Blues,Forward,"A developing scoring winger who put the puck in the net with great efficiency, slotting in with talented linemates and finding soft areas of the ice to generate one-timers and deflections. Throws the body and battles for pucks at both ends, although despite his enthusiasm his size makes it tough for him to win those spars. Will need to expand his game to continue to succeed in this role, as any reduction to his finishing rate would expose the limitations of his game with the puck as it stands now."
Robert Thomas,St. Louis Blues,Forward,"A skilled top-line playmaking centre who has established himself as one of the league’s best and most prolific passers. Plays the game with patience and deliberation, and even though he’s a premier rush player and often gets breakaways he doesn’t skate quickly; there’s almost a leisurely pace to how he moves with the puck. Always scanning and mapping out the offensive zone, he has the vision to identify the best passing target on the ice before the puck is even on his stick (often catching opposing defenders stunned with a no-look tape to tape pass) and the execution to deliver the “obvious” pass into the slot through stick and limbs. Few move the puck from “safe” areas like behind the net to high-danger areas nearly as well. An increasingly efficient finisher with a sneaky wrist shot who doesn’t shoot the puck unless he absolutely has to and especially refuses to put it on net from the perimeter at 5v5. Increasingly trusted defensively, but while he’s got a good stick and has become a good faceoff taker his chance suppression at evens has generally been poor, probably due in large part to how he plays offence."
Brayden Schenn,St. Louis Blues,Forward,"A veteran offensive centre who plays a complementary role at this point of his career. Has a solid and versatile shot with the ability to score from distance, and likes to blow the zone early to chase the odd-man counter-attack. Plays with a physical edge and forces the play, but the high-risk style has evident downsides and the Blues give up plenty with him on the ice. With the right linemates he can provide value as a passer but it seems unlikely that he could still drive a top six line."
Pius Suter,St. Louis Blues,Forward,"A middle-six shut-down centre who overcomes extremely poor skating, small size, and unexceptional puck skills with a strong defensive stick, smarts, scoring touch, and a willingness to get to the front of the net. Positions himself in the slot and keeps his stick free for linemates to target, throwing one-timers and rebounds on net. An asset defensively at even strength and the penalty kill despite being spotty in the dot due to strong positioning and a good stick."
Justin Faulk,St. Louis Blues,Defence,"A veteran offensive defenceman who takes risks all over the ice, with mixed results. Eager to jump into the rush and uses his stocky frame to protect the puck when it’s on his stick. Distributes the puck in the offensive zone, often getting into the centre lane and feeding wingers for scoring chances. Has a hard and heavy shot that he uses enthusiastically, but has no issue carrying the puck closer to the net before releasing it. Without the puck, tries to disrupt plays aggressively which results in a lot of takeaways but even more instances where he ends up blown past or chasing while the puck swings into the slot."
Colton Parayko,St. Louis Blues,Defence,"A big-minute top pair defensive defenceman blessed with exceptional physical gifts including massive size and reach and shockingly blazing footspeed. Absorbs difficult minutes, using his long stick to close off passing lanes in tight and his mobility to recover loose pucks, although he does often have trouble gathering them without allowing time for forecheckers to put them back in play. As with many blueliners of his height, not a prolific hitter. One of the most prolific puck-carrying defencemen in the league who mostly eschews break-out passes for doing the work of navigating the neutral zone himself, building up speed to gain the zone. Once in the offensive zone his game becomes much simpler, using a punishing slap-shot from the point or drifting to the circles to whip a wrist shot. While his defensive presence is stabilizing, the more puck-dominant aspects of his game can tend to keep it out of the hands of more dynamic forwards in transition, with consequences when it comes to overall team offence with him on the ice."
Nick Leddy,St. Louis Blues,Defence,"A swift-footed transition defenceman who uses his mobility to transport the puck up the ice either through breakout passes or on his stick. Capable of jumping up in the zone to distribute the puck to dangerous areas but isn’t a difference-maker offensively and rarely shoots. Plays a soft gap defending the rush, allowing opponents to gain the zone but protecting the middle of the ice. Struggles once set up in the defensive zone, rarely separating opponents from the puck."
Ryan Suter,St. Louis Blues,Defence,"A veteran defensive defenceman who plays a conservative game. Extremely and increasingly limited mobility prevents him from making ambitious plays, and if the play gets behind him things can go badly very quickly. Although he has a reasonably strong breakout pass he is fairly turnover prone relative to his infrequent puck touches. Doesn’t defend the blueline aggressively but sags back to direct traffic towards the boards and limit chances. Doesn’t do much in the offensive zone but set his partner up for one-timers."
Cam Fowler,St. Louis Blues,Defence,"A veteran two-way puck-moving defenceman, durable enough to withstand significant and difficult minutes while avoiding injury. Offers a stable if unexceptional skillset, moving the puck in transition and distributing it in the offensive zone with crisp, accurate passes that rarely result in turnovers. Reasonably active in the defensive zone with solid positioning, but does have a tendency to get walked when facing rushing attackers. Would likely be better-suited to a second-pairing role."
Oliver Bjorkstrand,Tampa Bay Lightning,Forward,"A two-way scoring winger who carries the puck in transition and plays a shot-first game in the offensive zone at even strength while dishing it on the powerplay. Works hard without the puck to regain it, chasing down loose pucks all over the ice and using a savvy defensive stick to separate opponents and work on the counter-attack. Despite a lack of size and foot speed, protects the puck well and controls possession well."
Anthony Cirelli,Tampa Bay Lightning,Forward,A high-end shut-down centre capable of winning shifts against top competition
Yanni Gourde,Tampa Bay Lightning,Forward,"A two-way playmaking centre who crashes the net and plays an active game with and without the puck. Harrasses opponents with stick checks, board battles, forechecking, and even hits despite being only 5’9. Light on his feet and manages the puck well, playing a straightforward transition game. A prolific passer, especially off extended offensive zone possessions where he often plays behind the net and extends his team’s cycling sequences by protecting the puck and making low-to-high passes. Once the puck gets to the point, he’s excellent at getting a stick on point shots. While he doesn’t create a high volume of shots for himself, the ones he does get are often in the blue point; unfortunately, his finishing touch is sub-par."
Jake Guentzel,Tampa Bay Lightning,Forward,"A star offensive winger who does everything necessary to make talented linemates better. Easy to play with because of his intelligence off the puck, willingness to go to the dangerous areas of the ice, strong finishing touch, and well-rounded offensive ability. Especially effective on lengthy cycling sequences where he is adept at getting defenders to lose sight of him until it’s too late and the puck’s on his stick in tight. Piles up scoring chances near the net including the inner slot, finding soft space near the back door and winning position in tight despite being relatively small and light. Particularly strong on deflections and gets to rebounds quick and cleanly, making him a great net-front option on the powerplay. Well above-average in almost all areas of the game including passing, but doesn’t need to spend a ton of time with the puck to make a big impact. Not very physical or abundantly fast but has a high motor nonetheless that makes him an effective and committed forechecker."
Brandon Hagel,Tampa Bay Lightning,Forward,"A top line two-way winger who tilts the ice at an elite level with a well-rounded set of skills at both ends of the ice. Well above-average in practically every area of the game, combining foot-speed, pace, motor, determination, creativity, and skill. Creates piles of breakaway and rush opportunities, bolting up the ice to receive break-out passes and catch defenders on the back-foot, and has the hands to beat them even when they do seem to have him cut off. Crashes the net at almost reckless speeds, taking plenty of damage in the interest of getting to loose pucks, rebounds, and back-door passes first. As easy as it is to envision this type of player having tunnel vision and always thinking shot-first, he thinks the game as quickly as he moves, allowing him to identify and execute split-second passing plays and one-touch sequences and spring linemates for breakaways, often with tape-to-tape saucer passes. Add in his active stick, forechecking motor, and willingness to battle for the puck and it’s tough to find a weak area of his game unless you’re fixated on bodychecking."
