player,team,position,scouting_report
Josh Anderson,Montreal Canadiens,Forward,"A hybrid scoring power forward and among the fastest skaters in the game whose weaknesses as a passer and defensive player make his style much more high-risk. Barrels down the ice, chases after pucks, and finishes his checks in the offensive zone. Despite breakaway speed, most of his goals come either from crashing the net for rebounds and one-timers or firing wrist shots from long distance. While not an absolutely incapable passer, his feet are certainly faster than his head and he rarely creates much for his linemates other than a bit of chaos. His puck pursuit does not often extend to the defensive zone, and when it does it’s often for the worse because he is quite prone to turning it over."
Nick Suzuki,Montreal Canadiens,Forward,"A skilled playmaking two-way centre first line. A puck-dominant player who acquires the puck through hard work in the defensive zone, with the hands to turn loose pucks and steals into clean exits and the mobility to carry it through the neutral zone. Can dish the puck across the seam off the rush or pick apart defences with clever one-timer set-ups from behind the net or across the slot. Very hesitant to shoot the puck himself but has added a tremendous finishing touch to his arsenal, beating goalies cleanly from range with a deceptive wrist shot release and picking corners with one-timers, especially on the powerplay. Has had issues in the past with offensive output and defensive commitment coming at the expense of one another, but has taken strides towards finding a strong balance with better possession play."
Cole Caufield,Montreal Canadiens,Forward,"A first line scoring winger who plays an exuberant and high-skill game limited by his diminutive size. His excellent wrist shot can beat goalies from range, and as a result he fires it from everywhere on the ice, especially the perimeter areas outside the slot. The same is true of his one-timer, which isn’t quite as strong and therefore is better used off cross-slot passes from his linemates -- he isn’t exactly a net-crasher but times his routes into the outer slot well and gets open to shoot on yawning cages. Similarly, he has great hands and is adept at navigating through defenders to get extra space to get his shot off. Still a clear shoot-first player but an increasingly capable playmaker who can find open linemates in dangerous areas and extend possessions by sending pucks to the point instead of just firing them. An extremely limited defensive player who’s not involved in his own end or on the forecheck, staying out of the fray and waiting for the puck to come to him."
Kirby Dach,Montreal Canadiens,Forward,"A developing playmaking centre with size and an enviable physical toolkit. Moves the puck up the ice with a strong skating stride and excellent hands, using his body to protect it, but has struggled to take the next step and turn those entries into scoring opportunities. Not a prolific shooter and when he does tally it’s generally because he put his big frame to use to get close to the net and either receive a quick pass or jump on a rebound off a scramble play. Sees the ice well and is a patient playmaker, confident enough to send lengthy cross-ice or stretch passes to his linemates. Possesses defensive upside due to his physical attributes but has been inconsistent in that area. Needs to get back on track following injuries."
Juraj Slafkovsky,Montreal Canadiens,Forward,"A developing power-forward. Uses his huge frame to battle for pucks, throw hits, and establish position in front of the net. Has a heavy shot that can beat goalies from distance, but just as willing to get to the ugly areas in front and muck around for rebounds and deflections. Crucially has displayed playmaking upside which if built upon would significantly raise his ceiling. For now he does set up linemates well, but his dangerous passes are typically more of the throw-the-puck-into-the-slot-and-see-what-happens than the kind of control that high-end passers show. Skates with below-average speed and is still working out how to connect the dots in transition between navigating the neutral zone and creating offence after crossing the blueline. Has a bad habit for playing with one hand on his stick when defending and trying (unsuccessfully) to get away with hooking and holding penalties while trying to backcheck hard, but he is involved and engaged physically. It remains to be seen whether he can develop into a play-driving all-around power forward or if he will ultimately be pigeon-holed as a skilled utility player."
Patrik Laine,Montreal Canadiens,Forward,"A sniping winger who can beat goalies from long-range. Whether it’s his punishing one-timer, which ranks among the hardest and most-used clappers in the league, or his equally challenging wrist shot, leaving him open from anywhere on the ice is a recipe for disaster. What separates him from the one dimensional distance shooters is an underrated and well-rounded offensive game; he has above-average speed and superb hands which allow him to navigate the neutral zone and create opportunities both for himself and his linemates off the rush. That playmaking will never be the focal point of his game but he’s not a single-minded shooter and moves the puck well, particularly in transition. All that said, the play does tend to funnel to the perimeter when he’s out there. He’s a harder worker defensively than he used to be, has a decent defensive stick, and is willing on occasion to use his body, but the way he creates offence combined with poor awareness without the puck tends to lead to poor outcomes regardless and he makes it tough for coaches to trust him."
Alex Newhook,Montreal Canadiens,Forward,"A developing offensive forward who can play centre or the wing. Pass-first, almost never shooting the puck from any area of the ice other than the slot. When he does put pucks on goal, though, they go in at an efficient clip on quick one-timers or opportunistic jumping on loose pucks. Shows some flashes of puck skills but doesn’t spend enough time with possession of it to drive play at a strong rate. Combo of foot speed and a decent stick could give him the tools to be a solid two-way player but it hasn’t yet translated."
Noah Dobson,Montreal Canadiens,Defence,"A top-pairing offensive defenceman who’s at his best when he’s active and ambitious with the puck. Likes to take shots from the point and is great at filtering them through for tips and rebounds but is much more dangerous when he jumps up in the play either by joining the rush or carrying the puck in tighter to create chances for himself or linemates. An adept puck-mover who moves his feet to create and exploit passing lanes in the offensive zone and is capable of delivering accurate stretch passes. Confident with the puck on his stick and opens up a lot of options in transition by threatening to carry it through the neutral zone, where he can even beat fellow defenders with dekes. A relatively lanky 6’4 who leaves something on the table physically and isn’t particularly strong in the net-front but isn’t afraid to race for loose pucks and battle along the wall. Exploitable off the rush where his gap is often way too aggressive or way too soft and can be caught looking a bit clueless losing track of where he’s meant to be and getting trapped behind the net. That said, he has the tools to be a competent in-zone defender, even if tilting the ice with the puck will likely remain his forté."
Lane Hutson,Montreal Canadiens,Defence,"A developing offensive defenceman who plays the game with creativity, deceptiveness, and ambition. Plays at a high pace but rarely in a straight line, using head and body fakes combined with agile feet to navigate the ice from end-board to end-board. Unafraid to get deep in the offensive zone along the boards and handle the puck, opening and scanning for passing and shooting lanes while defenders try to figure out who’s supposed to take him and keep up. Never stands still, walking the blueline with rapid cross-overs waiting for the defending winger to over-commit so he can dart towards the net and create a numerical advantage. Chases down pucks in the offensive zone to keep possession alive, stick checking and engaging on the boards. An excellent passer able to execute on the opportunities he opens up and deliver high-danger feeds across the zone like few defencemen. Solid in the defensive zone in areas where his agility and aggressiveness can manifest, like defending the blueline, angling rushers to the perimeter, and retrieving pucks, but urgency isn’t always there on in-zone sequences and his physical limitations become much more pronounced."
Mike Matheson,Montreal Canadiens,Defence,"A smooth-skating two-way defenceman capable of playing heavy and difficult minutes. Extremely visible all over the ice, his mobility and stamina lead him to cover more ground in all situations than almost any other blueliner, from pursuing forwards and chasing down pucks in the defensive zone to forcing turnovers to battling to carrying pucks with speed through the neutral zone. Not an especially creative player in the offensive zone but can walk the blueline and dish the puck from the centre lane, especially on the powerplay where he capably delivers tape to tape passes to flanking wingers. Otherwise, his offence mostly revolves his own shot, which goes in at a good rate and creates deflections and rebounds when it doesn’t. His desire to push the pace can have predictable defensive consequences, like his high-risk high-reward disruptive rush defence, his tendency to get out of position chasing down pucks, and his high turnover rate."
Kaiden Guhle,Montreal Canadiens,Defence,"A developing defence-first blueliner with excellent mobility and promise as a puck-mover. When he’s at his best, he uses his skating to proactively snuff out plays early and keep opponents away from prime real estate. Uses his size to absorb contact along the boards, battle for pucks, and throw hits. Has a solid first pass and is strong on the puck, but can be prone to turnovers when moving from defence to offence. Wants to be involved at both ends of the ice and occasionally ventures deep into the offensive zone, joining the rush. Has all the tools to be a premier shutdown defenceman who can chip in offensively."
Filip Forsberg,Nashville Predators,Forward,"A shoot-first star winger with superb hands and a high-end all-around skillset. Shoots the puck from everywhere in the zone because he can pick corners from long-range. Uses his puck-handling skills to take the puck from the perimeter to the hashmarks, with a curl and drag pucks release that gives him extra space and deceptiveness. Has the patience to make the extra move to beat a goalie instead of throwing the puck on net. Not all finesse, and can bully his way to the net-front and get to garbage goals as well. Not a particularly speedy player but doesn’t need a lot of strides to get where he wants to and has generally been a difference-maker in transition as a result. At his best, is a dedicated puck hound who kills possessions in all three zones and turns steals into offensive opportunities for him and his linemates. No slouch as a playmaker, recognizing openings in the offensive zone quickly and sending the puck to the perimeter to keep in-zone sequences alive."
Jonathan Marchessault,Nashville Predators,Forward,"A veteran scoring winger. An opportunistic scorer who gets to the net and hangs out in the slot or at the back door to tap in high-danger passes and jam in garbage goals. Not a high-volume playmaker but moves the puck with flair and confidence in tight areas. Poor footspeed limits his ability to control the game off the rush or win races to loose pucks, and combines with his lack of size to increasingly be an issue defensively, but he remains smart enough to support linemates in transition. Ryan O’Reilly"
Erik Haula,Nashville Predators,Forward,A veteran defensive centre who at his best provides a stabilizing presence including chip outs of his own zone and efficiency winning battles both along the wall and in the faceoff dot. Offers some offensive upside by crashing the net. Takes a lot of stick infractions and doesn’t handle the puck enough to draw many.
Steven Stamkos,Nashville Predators,Forward,"A veteran scoring forward with a powerful one-timer who does most of his work off the puck. Hockey I.Q. remains intact and he still moves around the ice pretty well, which allows him to get in position to power home one-timers or find holes around a goalie’s leg pads to whip in wrist shots. Relies upon linemates to do the work in transition and in the defensive zone but possesses underrated playmaking skill that keeps him from being a pure trigger-man; nonetheless, not a line driver at this point in his career."
Roman Josi,Nashville Predators,Defence,"A veteran offensive defenceman with elite skill in transition and the ability to thrive with an extremely heavy workload with the puck in all three zones. One of the most active blueliners in the league, quarterbacking his team’s offence on in-zone possessions and leading the rush as well. Poise and patience are the keys to his offensive game, as he lacks the straight-ahead speed of most of his transition-dominant peers, but his ability to not only dish the puck accurately to a streaking winger but also receive a pass from his partner in the neutral zone and establish offensive zone possession keeps opponents honest. A confident and capable loose puck retriever, but prefers to let his partner fight those battles so he can get that extra step up ice. Clever at walking the offensive blueline to sift through wrist shots but has no qualms about absolutely hammering a slap shot from the point. An elite playmaker who sees the ice extremely well and executes at a high level."
Brady Skjei,Nashville Predators,Defence,"A veteran two-way defenceman with solid physical tools including size and mobility. Covers ground quickly and protects the puck well, skills he uses to lead zone entries and retrieve pucks in the defensive zone, but of which he’s capable of executing at a high rate. Doesn’t have the prettiest skating stride but his straight-ahead speed is solid; his agility is not great, though, and when he loses track of the play in the defensive zone opponents can exploit this weakness and leave him chasing and wagging his stick around ineffectively. His reach is good but his ability to actually shut down passing lanes is inconsistent. Boasts a heavy and accurate point shot as well as decent passing ability."
Jesper Bratt,New Jersey Devils,Forward,"A star rushing winger who pushes the play and flies up the ice in transition, forcing opposing defenders to back off and taking advantage of the space to beat goalies cleanly or force them to move side-to-side with high-danger passes. While his bread and butter is undeniably the rush, where he ranks as one of the most prolific creators of offence in the game, Bratt also has a terrific one-timer and isn’t afraid to go to the net-mouth to stuff in ugly goals either, especially with the man advantage. Not a total liability defensively, but not one to engage in the dirty areas of the ice or get much involved unless the opportunity for a counter-attack presents itself."
Jack Hughes,New Jersey Devils,Forward,"An elite playmaking centre, one of the most talented players in the game. Boasts spectacular puck skills that allow him to spend more time with possession than almost anybody else in the NHL, whether he’s creatively navigating his way through the neutral zone, taking on defenders one-on-one, weaving around opponents in the offensive zone, driving the puck to the net, or feeding his linemates, everything he does with control has layers of deception and skill. Buzzes around without the puck, stealing it off opponents and putting in the work to get it back on the right side of the ice, but is unavoidably affected by his size and stature both in terms of durability, ability (and willingness) to engage physically, and capability of winning even a respectable share of his faceoffs. Has had difficulty remaining healthy."
Timo Meier,New Jersey Devils,Forward,"A skilled scoring winger with a nose for the net who produces a vast quality of shots in tight off of extended offensive zone possession, especially with the man advantage. Uses a sturdy frame and above-average speed to carry the puck in transition, protect it from opposing defenders, and get to the dangerous areas of the offensive zone. Soft hands which he uses to manipulate defencemen and make clever bang-bang passes across the slot. Can get caught deep in the zone on counter-attacks and turns the puck over at a fairly high rate, but generally is a strong possession player and a hard worker in the defensive zone."
Dawson Mercer,New Jersey Devils,Forward,"A developing scoring winger who does almost all of his damage from within a few feet of the net. Doesn’t create a large volume of scoring chances but finishes at an efficient rate. Similarly, while not blessed with exceptional playmaking ability he’ll make the odd crafty feed across the slot that would hint at a higher upside to his game. Can chip in on the forecheck, chasing down dump-ins and rebounds, but doesn’t play physically or engage too much along the boards. Has some skill in transition but turns the puck over a lot."
Stefan Noesen,New Jersey Devils,Forward,"A veteran net-front two-way winger who plays a hard-nosed game chasing and battling for pucks in the slot and along the boards. A slow and graceless skater, but isn’t expected to do much with the puck other than dump it in or out and jam at it in the crease. That said, he’s an underrated passer in tight who despite not creating a high quantity of shots with his playmaking does move it well across the slot. His simple game transfers to the powerplay as well."
Ondrej Palat,New Jersey Devils,Forward,"A veteran utility winger who despite losing pretty much all of his footspeed in the past few seasons continues to be one of the more effective complementary two-way players in the game. Whether it’s working in the defensive zone to make the smart play to chip the puck out of make a clean pass, engage along the boards or on the forecheck, chase down loose pucks in either zone, or make simple continuation plays in the offensive zone to maintain possession, what he lacks in flash and offensive dominance he makes up for in subtle effectiveness."
Dougie Hamilton,New Jersey Devils,Defence,"A top-pairing offensive defenceman with a bomb of a shot that he uses at every opportunity, whether from the point or closer to the net. Willing to leap up in the play and make himself open for high-danger one-timer passes. Helps maintain offensive zone possession by getting pucks through traffic and deeper into the zone. A solid puck-mover in transition who can dish the puck in the offensive zone, but much prefers to put it on goal whenever possible. Doesn’t use his size to throw hits or battle along the boards or in front of the net, and takes far too many frustrating infractions while drawing next to none himself. An awkward and slow skater. Not a prolific rush defender, but uses his long stick to force dump-ins and protect the middle of the ice. Despite his vastness, blocks fewer shots than any defenceman in the league."
Luke Hughes,New Jersey Devils,Defence,"A developing offensive defenceman who skates faster than any other blueliner in the league and spends plenty of time with the puck on his stick. Moves the puck well in transition, drawing penalties with his creative puck control. While he hardly ever throws a body check, he works hard when he doesn’t have the puck, battling along the boards, chasing down loose pucks, and disrupting plays with his stick. An unfortunate side effect of this is that he gets targeted by opposing checkers a lot. In the offensive zone he’s demonstrated quality and efficient playmaking and flashed serious skills with the man advantage."
Simon Nemec,New Jersey Devils,Defence,"A developing offensive defenceman who has shown early indications of an efficient game with the puck. Prefers to move the puck up the ice with possession, and while he doesn’t boast the fastest straight-line speed in the league he’s agile and deceptive. This also allows him to navigate the offensive zone and get to more dangerous areas, a strategy which made his shots among the most dangerous among blueliners as a rookie, even though he scored on few of them. His shot was a strength as a prospect, and given his ability to create quality chances this could raise his offensive ceiling. Play without the puck was more of a challenge, but despite throwing almost no checks and struggling to handle on-coming traffic off the rush he at least showed a willingness to engage physically along the boards."
Brett Pesce,New Jersey Devils,Defence,"A top four defensive defenceman who focuses on protecting the slot at 5-on-5 and the penalty kill. Plays an aggressive and effective prevent-defence style against the rush, using smart positioning and an effective stick to defend the blueline and force dump-ins and turnovers. Similarly closes off passing lanes and shuts down opponents’ attempts to penetrate the slot with high-danger feeds. Doesn’t chase hits or retrievals in his own end and makes the safe and successful chip-off-the-glass play more often than not. Conversely, is one of the league’s more prolific blueliners when it comes to entering the zone, and while he dumps it in plenty he’s not opposed to making a play himself to establish possession. After that, it’s a simple pucks on net game."
Mathew Barzal,New York Islanders,Forward,"A top line playmaking winger whose dazzling speed, hands, and creativity make him one of the most dynamic offensive players in the game. Can win a footrace against almost any player in the league and blazes through the neutral zone, deftly navigating around defenders and protecting the puck without sacrificing speed and control. Makes taking the puck from end to end, around the net, and back out into the top of the zone look almost easy. Spends a ton of time in the offensive zone with the puck on his stick, circling and protecting and scanning for a passing target. He’s generally reluctant to just get to the slot and shoot the puck himself, and the greatest defect in his game is that he too-often settles for the safety valve of a low-to-high or drop pass to a defenceman or forward hanging out on the perimeter, which often seems like a waste after the lengthy adventure he took getting the puck to that spot in the first place. He’s at his best when he plays with a shooter who gets to soft areas in the high slot or back-door, and he’s capable of making some absolutely jaw-dropping feeds if given the right target. He turns the puck over at a very low rate but you sometimes wish he was willing to take a few more risks for higher-upside plays. The defensive play is less reliable, as sometimes his stick-checking, end-to-end theatrics, and contentious possession play keep things safely out of danger and sometimes he’s a bit less attentive and not as physically-engaged as he could be."
Jonathan Drouin,New York Islanders,Forward,"A complementary playmaking winger. After struggling as a play-driver, was able to better use his crafty passing ability as more of a utility player, managing the puck more conservatively and focusing on advancing the play to his linemates instead of trying to do more himself. Uses short one-timer set-ups to change the angle and get goalies moving, and while the rushes and dazzling dekes that seemed like his bread and butter have mostly left his game the result is a more focused and productive impact."
Anthony Duclair,New York Islanders,Forward,"A middle-six scoring winger who uses high-end straight line speed to dart to open ice, receive passes, and finish. Doesn’t spend much time with the puck himself but gets to dangerous areas for one-timers and catch-and-shoot rushes. Flashes high-danger passing ability but isn’t possession-dominant enough to use it frequently. Creates a high volume of breakaways and has slick hands at top speed that lead to highlight-reel goals, but the same all-out attacking mindset leads to a dereliction of his defensive responsibilities and cancels out much of his contributions."
Simon Holmstrom,New York Islanders,Forward,A middle-six scoring two-way winger
Bo Horvat,New York Islanders,Forward,
Anders Lee,New York Islanders,Forward,
Jean-Gabriel Pageau,New York Islanders,Forward,
Tony DeAngelo,New York Islanders,Defence,
Alex Romanov,New York Islanders,Defence,
Adam Pelech,New York Islanders,Defence,
Will Cuylle,New York Rangers,Forward,"A developing physical winger with offensive upside. Throws crushing body-checks, sometimes crossing the line into questionable territory, and willing to answer the bell. Boasts above-average speed which allows him to get breakaways and win races to pucks at both ends of the ice. A solid net-front presence with great hand-eye coordination for deflections. Takes a lot of shots from outside the slot because he’s got a rangy wrist shot that can beat goalies from the hashmarks and beyond. Not much of a passer at this point and doesn’t spend much time with the puck."
